A1: Date | B1: Addition | C1: Plant 1 (height in cm) | D1: Plant 2 (height in cm) | E1: Plant 3 (height in cm) | F1: Health
A2: 39468 | B2: Fertilizer | C2: 1 | D2: 2 | E2: 3 | F2: Good
A3: 39468 | B3: Dog Food | C3: 2 | D3: 2 | E3: 1 | F3: Very Good
A4: 39474 | B4: Fertilizer | C4: 1 | D4: 2 | E4: 2 | F4: Good
A5: 39474 | B5: Dog Food | C5: 2 | D5: 4 | E5: 1 | F5: Very Good
A6: 39486 | B6: Fertilizer | C6: 3 | D6: 1 | E6: 3 | F6: Good
A7: 39486 | B7: Dog Food | C7: 2 | D7: 2 | E7: 2 | F7: Good
A8: 39491 | B8: Fertilizer | C8: 4 | D8: 3 | E8: 2 | F8: Good
A9: 39491 | B9: Dog Food | C9: 1 | D9: 2 | E9: 2 | F9: OK
A11: Health Scores:
A12: 4 | B12: Very Good
A13: 3 | B13: Good
A14: 2 | B14: OK
A15: 1 | B15: Poor
A17: Date | B17: Addition | C17: Average Height (cm)
A18: 39468 | B18: Dog Food | C18: =AVERAGE(C2:E2) -> 2
A19: 39474 | B19: Dog Food | C19: =AVERAGE(C3:E3) -> 1.6666666666666667
A20: 39486 | B20: Dog Food | C20: =AVERAGE(C4:E4) -> 1.6666666666666667
A21: 39491 | B21: Dog Food | C21: =AVERAGE(C5:E5) -> 2.3333333333333335
A22: 39468 | B22: Fertilizer | C22: =AVERAGE(C6:E6) -> 2.3333333333333335
A23: 39474 | B23: Fertilizer | C23: =AVERAGE(C7:E7) -> 2
A24: 39486 | B24: Fertilizer | C24: =AVERAGE(C8:E8) -> 3
A25: 39491 | B25: Fertilizer | C25: =AVERAGE(C9:E9) -> 1.6666666666666667
A28: Addition | B28: Average Growth (cm)
A29: Fertilizer | B29: =C24-C18 -> 1
A30: Dog Food | B30: =C25-C19 -> 0