A1: Back: | B1: Red: | C1: Blue | D1: White: | E1: Black: | F1: Green: | G1: Pink: | H1: Yellow: | I1: Total Eaten: | L1: OBSERVED
A2: B | B2: 7 | C2: 6 | D2: 4 | E2: 3 | F2: 3 | G2: 7 | H2: 4 | I2: 61 | M2: Same | N2: Different | O2: Total | P2: Greater or Less?
A3: B | B3: 4 | C3: 8 | D3: 5 | E3: 15 | F3: 2 | G3: 9 | H3: 3 | I3: 66 | L3: Blue | M3: 391 | N3: 1382 | O3: =SUM(M3:N3) -> 1773 | P3: =IF(M3>M13,"Greater","Less") -> Greater
A4: B | B4: 2 | C4: 5 | D4: 1 | E4: 4 | F4: 3 | G4: 7 | H4: 4 | I4: 67 | L4: Green | M4: 228 | N4: 1236 | O4: =SUM(M4:N4) -> 1464 | P4: =IF(M4>M14,"Greater","Less") -> Greater
A5: B | B5: 2 | C5: 7 | D5: 7 | E5: 11 | F5: 8 | G5: 6 | H5: 6 | I5: 40 | L5: Yellow | M5: 292 | N5: 382 | O5: =SUM(M5:N5) -> 674 | P5: =IF(M5>M15,"Greater","Less") -> Greater
A6: B | B6: 5 | C6: 9 | D6: 8 | E6: 5 | F6: 3 | G6: 2 | H6: 11 | I6: 66 | L6: Red | M6: 164 | N6: 326 | O6: =SUM(M6:N6) -> 490 | P6: =IF(M6>M16,"Greater","Less") -> Greater
A7: B | B7: 4 | C7: 5 | D7: 11 | E7: 11 | F7: 5 | G7: 3 | H7: 5 | I7: 55 | L7: White | M7: 626 | N7: 1035 | O7: =SUM(M7:N7) -> 1661 | P7: =IF(M7>M17,"Greater","Less") -> Greater
A8: B | B8: 4 | C8: 8 | D8: 11 | E8: 2 | F8: 11 | G8: 4 | H8: 6 | I8: 58 | L8: Pink | M8: 316 | N8: 1817 | O8: =SUM(M8:N8) -> 2133 | P8: =IF(M8>M18,"Greater","Less") -> Greater
A9: B | B9: 9 | C9: 2 | D9: 5 | E9: 13 | F9: 2 | G9: 2 | H9: 8 | I9: 40 | L9: Black | M9: 372 | N9: 1415 | O9: =SUM(M9:N9) -> 1787 | P9: =IF(M9>M19,"Greater","Less") -> Greater
A10: B | B10: 5 | C10: 22 | D10: 7 | E10: 4 | F10: 4 | G10: 3 | H10: 1 | I10: 63
A11: B | B11: 9 | C11: 11 | D11: 4 | E11: 6 | F11: 6 | G11: 8 | H11: 7 | I11: 54 | L11: EXPECTED
A12: B | B12: 7 | C12: 13 | D12: 4 | E12: 12 | F12: 2 | G12: 4 | H12: 4 | I12: 58 | M12: Same | N12: Different | O12: Total
A13: B | B13: 7 | C13: 15 | D13: 1 | E13: 6 | F13: 6 | G13: 4 | H13: 8 | I13: 57 | L13: Blue | M13: =O3/7 -> 253.28571428571428 | N13: =O3-M13 -> 1519.7142857142858 | O13: =SUM(M13:N13) -> 1773
A14: B | B14: 7 | C14: 18 | D14: 3 | E14: 5 | F14: 2 | G14: 10 | H14: 8 | I14: 51 | L14: Green | M14: =O4/7 -> 209.14285714285714 | N14: =O4-M14 -> 1254.8571428571429 | O14: =SUM(M14:N14) -> 1464
A15: B | B15: 14 | C15: 4 | D15: 13 | E15: 6 | F15: 7 | G15: 2 | H15: 9 | I15: 39 | L15: Yellow | M15: =O5/7 -> 96.285714285714292 | N15: =O5-M15 -> 577.71428571428567 | O15: =SUM(M15:N15) -> 674
A16: B | B16: 7 | C16: 8 | D16: 0 | E16: 0 | F16: 10 | G16: 11 | H16: 16 | I16: 66 | L16: Red | M16: =O6/7 -> 70 | N16: =O6-M16 -> 420 | O16: =SUM(M16:N16) -> 490
A17: B | B17: 9 | C17: 7 | D17: 0 | E17: 0 | F17: 6 | G17: 11 | H17: 11 | I17: 61 | L17: White | M17: =O7/7 -> 237.28571428571428 | N17: =O7-M17 -> 1423.7142857142858 | O17: =SUM(M17:N17) -> 1661
A18: B | B18: 5 | C18: 5 | D18: 8 | E18: 7 | F18: 6 | G18: 9 | H18: 12 | I18: 51 | L18: Pink | M18: =O8/7 -> 304.71428571428572 | N18: =O8-M18 -> 1828.2857142857142 | O18: =SUM(M18:N18) -> 2133
A19: B | B19: 1 | C19: 22 | D19: 7 | E19: 3 | F19: 7 | G19: 5 | H19: 0 | I19: 59 | L19: Black | M19: =O9/7 -> 255.28571428571428 | N19: =O9-M19 -> 1531.7142857142858 | O19: =SUM(M19:N19) -> 1787
A20: B | B20: 7 | C20: 14 | D20: 5 | E20: 8 | F20: 4 | G20: 4 | H20: 8 | I20: 55
A21: B | B21: 9 | C21: 8 | D21: 4 | E21: 6 | F21: 7 | G21: 6 | H21: 8 | I21: 56
A22: B | B22: 7 | C22: 9 | D22: 8 | E22: 6 | F22: 9 | G22: 7 | H22: 10 | I22: 30 | L22: p-value for test | N22: =CHITEST(M3:N9,M13:N19) -> 0
A23: B | B23: 4 | C23: 5 | D23: 12 | E23: 5 | F23: 2 | G23: 10 | H23: 8 | I23: 65 | L23: conclusion: there IS a significant difference between the
A24: B | B24: 6 | C24: 8 | D24: 7 | E24: 7 | F24: 6 | G24: 10 | H24: 10 | I24: 11 | L24: observed and expected observations; observations (actually selected colors)
A25: B | B25: 6 | C25: 7 | D25: 3 | E25: 15 | F25: 9 | G25: 3 | H25: 1 | I25: 39 | L25: deviate from the expected frequency (supposed random selected of colors)
A26: B | B26: 13 | C26: 11 | D26: 5 | E26: 0 | F26: 6 | G26: 4 | H26: 5 | I26: 68
A27: B | B27: 6 | C27: 7 | D27: 12 | E27: 9 | F27: 6 | G27: 7 | H27: 7 | I27: 46
A28: B | B28: 1 | C28: 18 | D28: 0 | E28: 11 | F28: 0 | G28: 8 | H28: 11 | I28: 57
A29: B | B29: 0 | C29: 8 | D29: 8 | E29: 13 | F29: 4 | G29: 11 | H29: 1 | I29: 60
A30: B | B30: 7 | C30: 8 | D30: 5 | E30: 7 | F30: 12 | G30: 8 | H30: 0 | I30: 60
A31: B | B31: 6 | C31: 8 | D31: 12 | E31: 0 | F31: 3 | G31: 7 | H31: 2 | I31: 65
A32: B | B32: 12 | C32: 7 | D32: 2 | E32: 6 | F32: 4 | G32: 8 | H32: 14 | I32: 41
A33: B | B33: 4 | C33: 24 | D33: 0 | E33: 2 | F33: 5 | G33: 5 | H33: 3 | I33: 59
A34: B | B34: 7 | C34: 10 | D34: 3 | E34: 7 | F34: 3 | G34: 8 | H34: 8 | I34: 58
A35: B | B35: 4 | C35: 7 | D35: 8 | E35: 10 | F35: 1 | G35: 11 | H35: 5 | I35: 65
A36: B | B36: 8 | C36: 9 | D36: 5 | E36: 2 | F36: 2 | G36: 5 | H36: 3 | I36: 62
A37: B | B37: 1 | C37: 12 | D37: 6 | E37: 6 | F37: 10 | G37: 8 | H37: 3 | I37: 57
A38: B | B38: 4 | C38: 12 | D38: 3 | E38: 1 | F38: 0 | G38: 1 | H38: 6 | I38: 76
A39: B | B39: 0 | C39: 14 | D39: 2 | E39: 4 | F39: 1 | G39: 7 | H39: 6 | I39: 83
A40: B | B40: 4 | C40: 10 | D40: 8 | E40: 7 | F40: 8 | G40: 5 | H40: 9 | I40: 40
A41: BK | B41: 12 | C41: 5 | D41: 9 | E41: 6 | F41: 4 | G41: 0 | H41: 14 | I41: 66
A42: BK | B42: 4 | C42: 1 | D42: 5 | E42: 2 | F42: 4 | G42: 4 | H42: 3 | I42: 75
A43: BK | B43: 5 | C43: 7 | D43: 3 | E43: 6 | F43: 1 | G43: 2 | H43: 6 | I43: 67
A44: BK | B44: 9 | C44: 4 | D44: 0 | E44: 12 | F44: 8 | G44: 4 | H44: 9 | I44: 57
A45: BK | B45: 5 | C45: 3 | D45: 10 | E45: 8 | F45: 11 | G45: 4 | H45: 10 | I45: 50
A46: BK | B46: 4 | C46: 2 | D46: 5 | E46: 23 | F46: 8 | G46: 4 | H46: 7 | I46: 47
A47: BK | B47: 6 | C47: 5 | D47: 4 | E47: 24 | F47: 10 | G47: 2 | H47: 3 | I47: 55
A48: BK | B48: 6 | C48: 10 | D48: 7 | E48: 13 | F48: 3 | G48: 5 | H48: 7 | I48: 33
A49: BK | B49: 0 | C49: 11 | D49: 12 | E49: 13 | F49: 6 | G49: 5 | H49: 5 | I49: 53
A50: BK | B50: 7 | C50: 8 | D50: 6 | E50: 19 | F50: 8 | G50: 3 | H50: 3 | I50: 51
A51: BK | B51: 0 | C51: 8 | D51: 3 | E51: 23 | F51: 2 | G51: 5 | H51: 9 | I51: 56
A52: BK | B52: 4 | C52: 4 | D52: 7 | E52: 14 | F52: 8 | G52: 6 | H52: 2 | I52: 67
A53: BK | B53: 12 | C53: 9 | D53: 0 | E53: 4 | F53: 8 | G53: 8 | H53: 6 | I53: 69
A54: BK | B54: 7 | C54: 9 | D54: 7 | E54: 10 | F54: 5 | G54: 9 | H54: 8 | I54: 30
A55: BK | B55: 6 | C55: 5 | D55: 7 | E55: 6 | F55: 10 | G55: 11 | H55: 9 | I55: 31
A56: BK | B56: 11 | C56: 9 | D56: 4 | E56: 5 | F56: 5 | G56: 9 | H56: 8 | I56: 39
A57: BK | B57: 5 | C57: 0 | D57: 10 | E57: 0 | F57: 8 | G57: 10 | H57: 16 | I57: 62
A58: BK | B58: 4 | C58: 5 | D58: 2 | E58: 11 | F58: 13 | G58: 14 | H58: 3 | I58: 50
A59: BK | B59: 15 | C59: 6 | D59: 11 | E59: 4 | F59: 10 | G59: 6 | H59: 3 | I59: 26
A60: BK | B60: 7 | C60: 11 | D60: 8 | E60: 4 | F60: 7 | G60: 12 | H60: 6 | I60: 46
A61: BK | B61: 6 | C61: 7 | D61: 4 | E61: 10 | F61: 1 | G61: 4 | H61: 12 | I61: 58
A62: BK | B62: 5 | C62: 7 | D62: 4 | E62: 3 | F62: 4 | G62: 10 | H62: 8 | I62: 64
A63: BK | B63: 5 | C63: 3 | D63: 7 | E63: 7 | F63: 4 | G63: 14 | H63: 0 | I63: 68
A64: BK | B64: 6 | C64: 8 | D64: 9 | E64: 12 | F64: 10 | G64: 4 | H64: 7 | I64: 29
A65: BK | B65: 8 | C65: 4 | D65: 6 | E65: 13 | F65: 6 | G65: 9 | H65: 8 | I65: 42
A66: BK | B66: 9 | C66: 11 | D66: 2 | E66: 9 | F66: 11 | G66: 7 | H66: 4 | I66: 50
A67: BK | B67: 5 | C67: 12 | D67: 6 | E67: 4 | F67: 9 | G67: 5 | H67: 9 | I67: 51
A68: BK | B68: 9 | C68: 5 | D68: 8 | E68: 12 | F68: 6 | G68: 2 | H68: 12 | I68: 44
A69: BK | B69: 8 | C69: 8 | D69: 10 | E69: 2 | F69: 10 | G69: 9 | H69: 5 | I69: 45
A70: BK | B70: 6 | C70: 5 | D70: 10 | E70: 6 | F70: 6 | G70: 9 | H70: 11 | I70: 32
A71: BK | B71: 7 | C71: 10 | D71: 0 | E71: 0 | F71: 6 | G71: 9 | H71: 17 | I71: 63
A72: BK | B72: 3 | C72: 4 | D72: 4 | E72: 13 | F72: 6 | G72: 4 | H72: 5 | I72: 63
A73: BK | B73: 6 | C73: 2 | D73: 2 | E73: 11 | F73: 11 | G73: 7 | H73: 4 | I73: 66
A74: BK | B74: 5 | C74: 4 | D74: 4 | E74: 13 | F74: 3 | G74: 6 | H74: 11 | I74: 58
A75: BK | B75: 5 | C75: 5 | D75: 11 | E75: 13 | F75: 1 | G75: 4 | H75: 3 | I75: 60
A76: BK | B76: 10 | C76: 5 | D76: 5 | E76: 22 | F76: 0 | G76: 3 | H76: 4 | I76: 62
A77: BK | B77: 3 | C77: 6 | D77: 4 | E77: 15 | F77: 4 | G77: 9 | H77: 4 | I77: 65
A78: G | B78: 12 | C78: 1 | D78: 14 | E78: 2 | F78: 9 | G78: 9 | H78: 3 | I78: 52
A79: G | B79: 2 | C79: 6 | D79: 4 | E79: 13 | F79: 8 | G79: 6 | H79: 13 | I79: 54
A80: G | B80: 9 | C80: 9 | D80: 3 | E80: 7 | F80: 6 | G80: 9 | H80: 9 | I80: 48
A81: G | B81: 11 | C81: 8 | D81: 6 | E81: 9 | F81: 9 | G81: 8 | H81: 3 | I81: 30
A82: G | B82: 3 | C82: 6 | D82: 7 | E82: 9 | F82: 3 | G82: 12 | H82: 16 | I82: 33
A83: G | B83: 6 | C83: 11 | D83: 0 | E83: 0 | F83: 9 | G83: 7 | H83: 8 | I83: 72
A84: G | B84: 8 | C84: 3 | D84: 7 | E84: 4 | F84: 11 | G84: 2 | H84: 14 | I84: 57
A85: G | B85: 6 | C85: 1 | D85: 12 | E85: 14 | F85: 2 | G85: 6 | H85: 9 | I85: 53
A86: G | B86: 0 | C86: 4 | D86: 12 | E86: 10 | F86: 16 | G86: 4 | H86: 2 | I86: 63
A87: G | B87: 3 | C87: 8 | D87: 11 | E87: 6 | F87: 14 | G87: 7 | H87: 2 | I87: 55
A88: G | B88: 6 | C88: 14 | D88: 5 | E88: 7 | F88: 13 | G88: 2 | H88: 5 | I88: 50
A89: G | B89: 1 | C89: 1 | D89: 10 | E89: 3 | F89: 4 | G89: 10 | H89: 8 | I89: 69
A90: G | B90: 6 | C90: 2 | D90: 8 | E90: 8 | F90: 6 | G90: 10 | H90: 2 | I90: 72
A91: G | B91: 7 | C91: 5 | D91: 8 | E91: 5 | F91: 9 | G91: 9 | H91: 9 | I91: 45
A92: G | B92: 6 | C92: 8 | D92: 9 | E92: 4 | F92: 10 | G92: 7 | H92: 8 | I92: 42
A93: G | B93: 3 | C93: 11 | D93: 4 | E93: 9 | F93: 6 | G93: 7 | H93: 12 | I93: 44
A94: G | B94: 13 | C94: 8 | D94: 3 | E94: 8 | F94: 6 | G94: 2 | H94: 10 | I94: 51
A95: G | B95: 7 | C95: 6 | D95: 7 | E95: 3 | F95: 1 | G95: 14 | H95: 6 | I95: 64
A96: G | B96: 6 | C96: 8 | D96: 1 | E96: 20 | F96: 5 | G96: 5 | H96: 4 | I96: 44
A97: G | B97: 2 | C97: 3 | D97: 8 | E97: 7 | F97: 6 | G97: 8 | H97: 12 | I97: 64
A98: G | B98: 0 | C98: 7 | D98: 7 | E98: 10 | F98: 4 | G98: 11 | H98: 5 | I98: 70
A99: G | B99: 5 | C99: 6 | D99: 8 | E99: 8 | F99: 7 | G99: 8 | H99: 9 | I99: 50
A100: G | B100: 3 | C100: 6 | D100: 15 | E100: 10 | F100: 10 | G100: 6 | H100: 3 | I100: 48
A101: G | B101: 7 | C101: 1 | D101: 6 | E101: 3 | F101: 6 | G101: 2 | H101: 9 | I101: 57
A102: G | B102: 4 | C102: 2 | D102: 13 | E102: 5 | F102: 7 | G102: 9 | H102: 10 | I102: 61
A103: G | B103: 0 | C103: 1 | D103: 20 | E103: 17 | F103: 0 | G103: 0 | H103: 14 | I103: 40
A104: G | B104: 7 | C104: 6 | D104: 3 | E104: 0 | F104: 12 | G104: 4 | H104: 9 | I104: 64
A105: G | B105: 3 | C105: 3 | D105: 4 | E105: 1 | F105: 6 | G105: 4 | H105: 12 | I105: 71
A106: G | B106: 4 | C106: 12 | D106: 5 | E106: 10 | F106: 2 | G106: 11 | H106: 10 | I106: 36
A107: G | B107: 3 | C107: 8 | D107: 4 | E107: 2 | F107: 15 | G107: 7 | H107: 8 | I107: 75
A108: G | B108: 0 | C108: 2 | D108: 2 | E108: 2 | F108: 6 | G108: 0 | H108: 14 | I108: 85
A109: P | B109: 9 | C109: 8 | D109: 3 | E109: 2 | F109: 7 | G109: 7 | H109: 5 | I109: 66
A110: P | B110: 7 | C110: 0 | D110: 7 | E110: 8 | F110: 5 | G110: 5 | H110: 15 | I110: 47
A111: P | B111: 7 | C111: 1 | D111: 5 | E111: 7 | F111: 9 | G111: 15 | H111: 7 | I111: 56
A112: P | B112: 8 | C112: 5 | D112: 7 | E112: 7 | F112: 8 | G112: 12 | H112: 5 | I112: 54
A113: P | B113: 2 | C113: 6 | D113: 2 | E113: 11 | F113: 3 | G113: 2 | H113: 9 | I113: 57
A114: P | B114: 10 | C114: 6 | D114: 7 | E114: 5 | F114: 7 | G114: 3 | H114: 12 | I114: 54
A115: P | B115: 10 | C115: 10 | D115: 3 | E115: 2 | F115: 7 | G115: 5 | H115: 6 | I115: 61
A116: P | B116: 6 | C116: 8 | D116: 8 | E116: 8 | F116: 13 | G116: 6 | H116: 6 | I116: 40
A117: P | B117: 5 | C117: 5 | D117: 6 | E117: 3 | F117: 6 | G117: 10 | H117: 10 | I117: 61
A118: P | B118: 4 | C118: 4 | D118: 4 | E118: 5 | F118: 9 | G118: 13 | H118: 8 | I118: 68
A119: P | B119: 2 | C119: 9 | D119: ? | E119: 7 | F119: 13 | G119: 4 | H119: 5 | I119: 34
A120: P | B120: 7 | C120: 4 | D120: 2 | E120: 12 | F120: 9 | G120: 9 | H120: 10 | I120: 45
A121: P | B121: 8 | C121: 11 | D121: 0 | E121: 0 | F121: 16 | G121: 0 | H121: 11 | I121: 60
A122: P | B122: 10 | C122: 0 | D122: 5 | E122: 0 | F122: 21 | G122: 5 | H122: 13 | I122: 58
A123: P | B123: 0 | C123: 27 | D123: 0 | E123: 0 | F123: 0 | G123: 8 | H123: 15 | I123: 50
A124: P | B124: 5 | C124: 3 | D124: 12 | E124: 9 | F124: 9 | G124: 3 | H124: 5 | I124: 57
A125: P | B125: 3 | C125: 2 | D125: 3 | E125: 9 | F125: 4 | G125: 21 | H125: 10 | I125: 52
A126: P | B126: 1 | C126: 10 | D126: 8 | E126: 0 | F126: 8 | G126: 13 | H126: 7 | I126: 57
A127: P | B127: 8 | C127: 10 | D127: 7 | E127: 7 | F127: 1 | G127: 6 | H127: 5 | I127: 65
A128: P | B128: 7 | C128: 7 | D128: 8 | E128: 7 | F128: 8 | G128: 7 | H128: 5 | I128: 53
A129: P | B129: 7 | C129: 5 | D129: 6 | E129: 3 | F129: 2 | G129: 3 | H129: 9 | I129: 55
A130: P | B130: 7 | C130: 8 | D130: 5 | E130: 8 | F130: 13 | G130: 5 | H130: 4 | I130: 53
A131: P | B131: 6 | C131: 7 | D131: 3 | E131: 9 | F131: 12 | G131: 6 | H131: 6 | I131: 56
A132: P | B132: 7 | C132: 5 | D132: 5 | E132: 5 | F132: 5 | G132: 11 | H132: 5 | I132: 57
A133: P | B133: 6 | C133: 10 | D133: 2 | E133: 9 | F133: 6 | G133: 9 | H133: 12 | I133: 38
A134: P | B134: 8 | C134: 8 | D134: 19 | E134: 4 | F134: 7 | G134: 4 | H134: 6 | I134: 40
A135: P | B135: 5 | C135: 11 | D135: 5 | E135: 8 | F135: 11 | G135: 7 | H135: 8 | I135: 44
A136: P | B136: 5 | C136: 12 | D136: 4 | E136: 8 | F136: 9 | G136: 6 | H136: 7 | I136: 49
A137: P | B137: 10 | C137: 5 | D137: 3 | E137: 10 | F137: 4 | G137: 3 | H137: 10 | I137: 61
A138: P | B138: 8 | C138: 7 | D138: 6 | E138: 10 | F138: 4 | G138: 7 | H138: 8 | I138: 63
A139: P | B139: 6 | C139: 6 | D139: 4 | E139: 8 | F139: 6 | G139: 0 | H139: 17 | I139: 67
A140: P | B140: 7 | C140: 1 | D140: 5 | E140: 7 | F140: 4 | G140: 7 | H140: 11 | I140: 65
A141: P | B141: 4 | C141: 3 | D141: 5 | E141: 6 | F141: 11 | G141: 2 | H141: 12 | I141: 65
A142: P | B142: 10 | C142: 7 | D142: 9 | E142: 4 | F142: 11 | G142: 2 | H142: 9 | I142: 39
A143: P | B143: 2 | C143: 11 | D143: 8 | E143: 7 | F143: 6 | G143: 8 | H143: 11 | I143: 47
A144: P | B144: 5 | C144: 3 | D144: 4 | E144: 7 | F144: 9 | G144: 0 | H144: 6 | I144: 70
A145: P | B145: 4 | C145: 4 | D145: 8 | E145: 7 | F145: 8 | G145: 9 | H145: 7 | I145: 66
A146: P | B146: 5 | C146: 8 | D146: 10 | E146: 0 | F146: 4 | G146: 11 | H146: 3 | I146: 66
A147: P | B147: 15 | C147: 4 | D147: 8 | E147: 7 | F147: 7 | G147: 5 | H147: 7 | I147: 40
A148: P | B148: 6 | C148: 4 | D148: 10 | E148: 4 | F148: 7 | G148: 11 | H148: 11 | I148: 46
A149: P | B149: 6 | C149: 7 | D149: 3 | E149: 6 | F149: 13 | G149: 12 | H149: 6 | I149: 38
A150: P | B150: 3 | C150: 11 | D150: 0 | E150: 4 | F150: 5 | G150: 9 | H150: 13 | I150: 59
A151: P | B151: 10 | C151: 5 | D151: 13 | E151: 3 | F151: 0 | G151: 8 | H151: 6 | I151: 63
A152: P | B152: 0 | C152: 3 | D152: 6 | E152: 0 | F152: 9 | G152: 7 | H152: 0 | I152: 86
A153: P | B153: 2 | C153: 2 | D153: 5 | E153: 1 | F153: 3 | G153: 10 | H153: 12 | I153: 82
A154: R | B154: 5 | C154: 4 | D154: 9 | E154: 5 | F154: 7 | G154: 13 | H154: 3 | I154: 59
A155: R | B155: 21 | C155: 1 | D155: 3 | E155: 6 | F155: 3 | G155: 10 | H155: 7 | I155: 55
A156: R | B156: 6 | C156: 5 | D156: 7 | E156: 9 | F156: 10 | G156: 4 | H156: 8 | I156: 53
A157: R | B157: 13 | C157: 0 | D157: 0 | E157: 0 | F157: 13 | G157: 4 | H157: 17 | I157: 55
A158: R | B158: 11 | C158: 7 | D158: 0 | E158: 17 | F158: 3 | G158: 8 | H158: 10 | I158: 43
A159: R | B159: 13 | C159: 6 | D159: 6 | E159: 6 | F159: 3 | G159: 6 | H159: 15 | I159: 37
A160: R | B160: 11 | C160: 8 | D160: 5 | E160: 5 | F160: 8 | G160: 12 | H160: 3 | I160: 43
A161: R | B161: 21 | C161: 7 | D161: 12 | E161: 0 | F161: 3 | G161: 2 | H161: 3 | I161: 59
A162: R | B162: 14 | C162: 1 | D162: 2 | E162: 3 | F162: 6 | G162: 6 | H162: 5 | I162: 51
A163: R | B163: 49 | C163: 0 | D163: 0 | E163: 0 | F163: 0 | G163: 0 | H163: 0 | I163: 67
A164: W | B164: 7 | C164: 4 | D164: 7 | E164: 2 | F164: 5 | G164: 3 | H164: 7 | I164: 54
A165: W | B165: 0 | C165: 2 | D165: 23 | E165: 1 | F165: 8 | G165: 2 | H165: 14 | I165: 59
A166: W | B166: 3 | C166: 2 | D166: 18 | E166: 6 | F166: 12 | G166: 6 | H166: 4 | I166: 49
A167: W | B167: 2 | C167: 4 | D167: 18 | E167: 9 | F167: 6 | G167: 2 | H167: 7 | I167: 53
A168: W | B168: 3 | C168: 8 | D168: 13 | E168: 4 | F168: 5 | G168: 6 | H168: 13 | I168: 36
A169: W | B169: 6 | C169: 5 | D169: 30 | E169: 3 | F169: 2 | G169: 1 | H169: 7 | I169: 52
A170: W | B170: 1 | C170: 10 | D170: 25 | E170: 3 | F170: 2 | G170: 2 | H170: 9 | I170: 58
A171: W | B171: 10 | C171: 1 | D171: 3 | E171: 25 | F171: 2 | G171: 2 | H171: 9 | I171: 58
A172: W | B172: 2 | C172: 13 | D172: 18 | E172: 6 | F172: 5 | G172: 2 | H172: 2 | I172: 52
A173: W | B173: 4 | C173: 8 | D173: 25 | E173: 1 | F173: 2 | G173: 5 | H173: 5 | I173: 61
A174: W | B174: 7 | C174: 11 | D174: 19 | E174: 0 | F174: 5 | G174: 3 | H174: 7 | I174: 48
A175: W | B175: 5 | C175: 10 | D175: 20 | E175: 4 | F175: 2 | G175: 1 | H175: 5 | I175: 50
A176: W | B176: 0 | C176: 5 | D176: 17 | E176: 9 | F176: 1 | G176: 11 | H176: 5 | I176: 57
A177: W | B177: 0 | C177: 6 | D177: 23 | E177: 7 | F177: 4 | G177: 7 | H177: 8 | I177: 50
A178: W | B178: 5 | C178: 4 | D178: 21 | E178: 14 | F178: 0 | G178: 4 | H178: 6 | I178: 46
A179: W | B179: 8 | C179: 3 | D179: 14 | E179: 7 | F179: 6 | G179: 5 | H179: 6 | I179: 46
A180: W | B180: 8 | C180: 5 | D180: 17 | E180: 3 | F180: 6 | G180: 3 | H180: 9 | I180: 62
A181: W | B181: 3 | C181: 5 | D181: 17 | E181: 0 | F181: 4 | G181: 9 | H181: 9 | I181: 68
A182: W | B182: 2 | C182: 15 | D182: 2 | E182: 2 | F182: 15 | G182: 4 | H182: 7 | I182: 40
A183: W | B183: 4 | C183: 7 | D183: 17 | E183: 0 | F183: 3 | G183: 3 | H183: 11 | I183: 61
A184: W | B184: 4 | C184: 3 | D184: 35 | E184: 0 | F184: 1 | G184: 0 | H184: 7 | I184: 61
A185: W | B185: 2 | C185: 2 | D185: 27 | E185: 3 | F185: 3 | G185: 1 | H185: 7 | I185: 67
A186: W | B186: 6 | C186: 3 | D186: 20 | E186: 7 | F186: 4 | G186: 6 | H186: 7 | I186: 41
A187: W | B187: 2 | C187: 8 | D187: 17 | E187: 5 | F187: 1 | G187: 4 | H187: 13 | I187: 42
A188: W | B188: 3 | C188: 6 | D188: 15 | E188: 5 | F188: 8 | G188: 8 | H188: 7 | I188: 44
A189: W | B189: 4 | C189: 4 | D189: 18 | E189: 4 | F189: 8 | G189: 3 | H189: 4 | I189: 59
A190: W | B190: 5 | C190: 9 | D190: 14 | E190: 3 | F190: 10 | G190: 7 | H190: 5 | I190: 40
A191: W | B191: 10 | C191: 9 | D191: 9 | E191: 7 | F191: 4 | G191: 10 | H191: 6 | I191: 44
A192: W | B192: 5 | C192: 1 | D192: 19 | E192: 2 | F192: 9 | G192: 5 | H192: 8 | I192: 53
A193: W | B193: 0 | C193: 4 | D193: 27 | E193: 3 | F193: 8 | G193: 1 | H193: 5 | I193: 64
A194: W | B194: 2 | C194: 3 | D194: 25 | E194: 2 | F194: 5 | G194: 7 | H194: 5 | I194: 63
A195: W | B195: 3 | C195: 8 | D195: 17 | E195: 3 | F195: 5 | G195: 5 | H195: 3 | I195: 58
A196: W | B196: 4 | C196: 7 | D196: 21 | E196: 4 | F196: 3 | G196: 3 | H196: 4 | I196: 59
A197: W | B197: 6 | C197: 6 | D197: 15 | E197: 1 | F197: 4 | G197: 0 | H197: 3 | I197: 64
A198: Y | B198: 0 | C198: 2 | D198: 0 | E198: 0 | F198: 3 | G198: 0 | H198: 24 | I198: 69
A199: Y | B199: 3 | C199: 3 | D199: 3 | E199: 5 | F199: 8 | G199: 1 | H199: 25 | I199: 59
A200: Y | B200: 5 | C200: 1 | D200: 12 | E200: 4 | F200: 7 | G200: 6 | H200: 16 | I200: 43
A201: Y | B201: 1 | C201: 9 | D201: 14 | E201: 8 | F201: 4 | G201: 7 | H201: 11 | I201: 40
A202: Y | B202: 3 | C202: 1 | D202: 4 | E202: 3 | F202: 2 | G202: 3 | H202: 20 | I202: 54
A203: Y | B203: 6 | C203: 3 | D203: 10 | E203: 0 | F203: 9 | G203: 6 | H203: 11 | I203: 60
A204: Y | B204: 4 | C204: 0 | D204: 6 | E204: 6 | F204: 1 | G204: 9 | H204: 21 | I204: 56
A205: Y | B205: 8 | C205: 4 | D205: 9 | E205: 6 | F205: 5 | G205: 8 | H205: 12 | I205: 38
A206: Y | B206: 1 | C206: 8 | D206: 4 | E206: 4 | F206: 7 | G206: 11 | H206: 13 | I206: 44
A207: Y | B207: 1 | C207: 2 | D207: 11 | E207: 6 | F207: 11 | G207: 6 | H207: 15 | I207: 45
A208: Y | B208: 2 | C208: 3 | D208: 10 | E208: 4 | F208: 8 | G208: 8 | H208: 19 | I208: 39
A209: Y | B209: 1 | C209: 5 | D209: 0 | E209: 3 | F209: 3 | G209: 4 | H209: 33 | I209: 61
A210: Y | B210: 2 | C210: 3 | D210: 1 | E210: 1 | F210: 4 | G210: 4 | H210: 20 | I210: 58
A211: Y | B211: 2 | C211: 1 | D211: 10 | E211: 1 | F211: 3 | G211: 0 | H211: 17 | I211: 72
A212: Y0 | B212: 0 | C212: 0 | D212: 5 | E212: 0 | F212: 0 | G212: 0 | H212: 35 | I212: 69