E3: Number | F3: Height | G3: Radius | H3: Volume
D4: Control Bag 1 | E4: 4 | F4: 2.5 | G4: 1.2 | H4: =G4*G4*F4*3.14 -> 11.303999999999998
D5: Control Bag 2 | E5: 5 | F5: 3 | G5: 1.4 | H5: =G5*G5*F5*3.14 -> 18.463199999999997
D6: Control Bag 3 | E6: 3 | F6: 1 | G6: 1 | H6: =G6*G6*F6*3.14 -> 3.14
D7: Control Bag 4 | E7: 3 | F7: 1 | G7: 1 | H7: =G7*G7*F7*3.14 -> 3.14
D8: Control Bag 5 | E8: 3 | F8: 1 | G8: 1 | H8: =G8*G8*F8*3.14 -> 3.14
D9: Control Bag 6 | E9: 3 | F9: 1 | G9: 1 | H9: =G9*G9*F9*3.14 -> 3.14
D10: Control Bag 7 | E10: 3 | F10: 1 | G10: 1 | H10: =G10*G10*F10*3.14 -> 3.14
D11: Control Bag 8 | E11: 3 | F11: 1 | G11: 1 | H11: =G11*G11*F11*3.14 -> 3.14
D12: Control Bag 9 | E12: 3 | F12: 1 | G12: 1 | H12: =G12*G12*F12*3.14 -> 3.14
D13: Ave (Control) | E13: =AVERAGE(E4:E6) -> 4 | F13: =AVERAGE(F4:F6) -> 2.1666666666666665 | G13: =AVERAGE(G4:G6) -> 1.2 | H13: =AVERAGE(H4:H6) -> 10.969066666666665
D14: My Substrate 1 | E14: 7 | F14: 2.2 | G14: 1.4 | H14: =G14*G14*F14*3.14 -> 13.539679999999999
D15: My Substrate 2 | E15: 5 | F15: 1.7 | G15: 1 | H15: =G15*G15*F15*3.14 -> 5.3380000000000001
D16: Average (my) | E16: =AVERAGE(E14:E15) -> 6 | F16: =AVERAGE(F14:F15) -> 1.95 | G16: =AVERAGE(G14:G15) -> 1.2 | H16: =AVERAGE(H14:H15) -> 9.438839999999999
E18: Number
D19: Ave (control) | E19: 4
D20: Ave (my) | E20: 6
E22: Volume
D23: Ave (control) | E23: 10.97
D24: Ave (my) | E24: 9.44