A2: Start of X | B2: 5 | E2: Start of Y | F2: 0
A3: End of X | B3: 60 | E3: End of Y | F3: 100
A4: Interval | B4: 5 | E4: Interval | F4: 10
A6: X | B6: Y
A7: =ROUND(((RAND() * (B$3-B$2) + B$2) / B$4),0)* B$4 -> 30 | B7: =ROUND(((RAND() * (F$3-F$2) + F$2) / F$4),0)* F$4 -> 10 | D7: Make sure to cross off duplicate pairs
A8: =ROUND(((RAND() * (B$3-B$2) + B$2) / B$4),0)* B$4 -> 20 | B8: =ROUND(((RAND() * (F$3-F$2) + F$2) / F$4),0)* F$4 -> 0 | D8: and to eliminate pairs that are outside
A9: =ROUND(((RAND() * (B$3-B$2) + B$2) / B$4),0)* B$4 -> 50 | B9: =ROUND(((RAND() * (F$3-F$2) + F$2) / F$4),0)* F$4 -> 80 | D9: of your study boundary
A10: =ROUND(((RAND() * (B$3-B$2) + B$2) / B$4),0)* B$4 -> 50 | B10: =ROUND(((RAND() * (F$3-F$2) + F$2) / F$4),0)* F$4 -> 70
A11: =ROUND(((RAND() * (B$3-B$2) + B$2) / B$4),0)* B$4 -> 10 | B11: =ROUND(((RAND() * (F$3-F$2) + F$2) / F$4),0)* F$4 -> 80 | D11: Make sure you use the correct units!
A12: =ROUND(((RAND() * (B$3-B$2) + B$2) / B$4),0)* B$4 -> 30 | B12: =ROUND(((RAND() * (F$3-F$2) + F$2) / F$4),0)* F$4 -> 10 | D12: (I.e., if your grid is in feet, this table should
A13: =ROUND(((RAND() * (B$3-B$2) + B$2) / B$4),0)* B$4 -> 50 | B13: =ROUND(((RAND() * (F$3-F$2) + F$2) / F$4),0)* F$4 -> 50 | D13: be in feet as well. If your grid is in meters,
A14: =ROUND(((RAND() * (B$3-B$2) + B$2) / B$4),0)* B$4 -> 10 | B14: =ROUND(((RAND() * (F$3-F$2) + F$2) / F$4),0)* F$4 -> 80 | D14: this table should be in meters as well).
A15: =ROUND(((RAND() * (B$3-B$2) + B$2) / B$4),0)* B$4 -> 20 | B15: =ROUND(((RAND() * (F$3-F$2) + F$2) / F$4),0)* F$4 -> 40
A16: =ROUND(((RAND() * (B$3-B$2) + B$2) / B$4),0)* B$4 -> 55 | B16: =ROUND(((RAND() * (F$3-F$2) + F$2) / F$4),0)* F$4 -> 90
A17: =ROUND(((RAND() * (B$3-B$2) + B$2) / B$4),0)* B$4 -> 25 | B17: =ROUND(((RAND() * (F$3-F$2) + F$2) / F$4),0)* F$4 -> 20
A18: =ROUND(((RAND() * (B$3-B$2) + B$2) / B$4),0)* B$4 -> 15 | B18: =ROUND(((RAND() * (F$3-F$2) + F$2) / F$4),0)* F$4 -> 100
A19: =ROUND(((RAND() * (B$3-B$2) + B$2) / B$4),0)* B$4 -> 10 | B19: =ROUND(((RAND() * (F$3-F$2) + F$2) / F$4),0)* F$4 -> 80
A20: =ROUND(((RAND() * (B$3-B$2) + B$2) / B$4),0)* B$4 -> 40 | B20: =ROUND(((RAND() * (F$3-F$2) + F$2) / F$4),0)* F$4 -> 80
A21: =ROUND(((RAND() * (B$3-B$2) + B$2) / B$4),0)* B$4 -> 30 | B21: =ROUND(((RAND() * (F$3-F$2) + F$2) / F$4),0)* F$4 -> 20
A22: =ROUND(((RAND() * (B$3-B$2) + B$2) / B$4),0)* B$4 -> 25 | B22: =ROUND(((RAND() * (F$3-F$2) + F$2) / F$4),0)* F$4 -> 40
A23: =ROUND(((RAND() * (B$3-B$2) + B$2) / B$4),0)* B$4 -> 60 | B23: =ROUND(((RAND() * (F$3-F$2) + F$2) / F$4),0)* F$4 -> 40
A24: =ROUND(((RAND() * (B$3-B$2) + B$2) / B$4),0)* B$4 -> 45 | B24: =ROUND(((RAND() * (F$3-F$2) + F$2) / F$4),0)* F$4 -> 80
A25: =ROUND(((RAND() * (B$3-B$2) + B$2) / B$4),0)* B$4 -> 45 | B25: =ROUND(((RAND() * (F$3-F$2) + F$2) / F$4),0)* F$4 -> 90
A26: =ROUND(((RAND() * (B$3-B$2) + B$2) / B$4),0)* B$4 -> 30 | B26: =ROUND(((RAND() * (F$3-F$2) + F$2) / F$4),0)* F$4 -> 100